layer_geom_type_s,layer_modified_dt,solr_geom,dct_references_s,dc_rights_s,uuid,dct_provenance_s,dc_subject_sm,dc_description_s,dct_issued_s,dct_temporal_sm,dc_creator_sm,dc_identifier_s,dc_relation_sm,georss_polygon_s,solr_year_i,dc_publisher_sm,layer_id_s,georss_box_s,dc_title_s,dc_format_s,dct_spatial_sm,dct_isPartOf_sm,layer_slug_s,dc_type_s,dc_source_sm
Point,2017-04-05T13:35:36Z,"ENVELOPE(-96.585987, -90.105588, 43.505997, 40.352171)","{""http://schema.org/downloadUrl"":""ftp://ftp.igsb.uiowa.edu/gis_library/IA_State/Infrastructure/k-12_schools.zip"",""http://schema.org/url"":""ftp://ftp.igsb.uiowa.edu/gis_library/IA_State/Infrastructure/"",""http://www.isotc211.org/schemas/2005/gmd/"":""https://opengeometadata.github.io/big-ten/dc/6b/4e/9113684e9899671a5e0379612c/iso19139.xml""}",Public,dc6b4e91-1368-4e98-9967-1a5e0379612c,Iowa,"[u'Structure', u'Schools']","This coverage includes all Public, Private, and Non-accredited PK-12 schools in Iowa. Also included are OTHER school programs including Specially Approved Schools; an Indian Contract School; and schools governed by the Board of Regents, Department of Corrections, and Department of Human Services. The schools included inThis coverage, their locations, and associated attribute information were taken from the NIowa Educational Directory: 1998-99 School YearN published by the Iowa Department of Education.",2016-05,1999,[u'Todd Bishop and Travis Baker'],dc6b4e91-1368-4e98-9967-1a5e0379612c,,40.352171 -96.585987 43.505997 -96.585987 43.505997 -90.105588 40.352171 -90.105588 40.352171 -96.585987,1999,[u'Iowa Department of Natural Resources'],,40.352171 -96.585987 43.505997 -90.105588,"Kindergarten through 12th Grade Schools: Iowa, 1999",Shapefile,"[u'Iowa, United States']",Iowa Department of Natural Resources (DNR),dc6b4e91-1368-4e98-9967-1a5e0379612c,Dataset,
Mixed,2017-04-05T13:35:42Z,"ENVELOPE(-98.0603, -88.6958, 44.7899, 39.0151)","{""http://schema.org/url"":""http://public.iowadot.opendata.arcgis.com/datasets/48bfff7ffbfa4555bed8c374e44c9300_15"",""http://www.isotc211.org/schemas/2005/gmd/"":""https://opengeometadata.github.io/big-ten/ae/64/b4/6671c04a99bd258c41101a5d8c/iso19139.xml"",""urn:x-esri:serviceType:ArcGIS#FeatureLayer"":""https://gis.iowadot.gov/public/rest/services/Pavement_Management/Pavement/FeatureServer/15"",""http://schema.org/downloadUrl"":""http://public.iowadot.opendata.arcgis.com/datasets/48bfff7ffbfa4555bed8c374e44c9300_15.zip""}",Public,ae64b466-71c0-4a99-bd25-8c41101a5d8c,Iowa,[u'Transportation'],"The Pavement Management Information Systems (PMIS) from 2011 through 2015 contains various levels of data on the pavement condition and history of Iowa Interstate and Primary routes. The data was collected by a 3rd party vendor and processed by the Iowa Department of Transportation. Starting in 2013, the data is reported in English Units instead of Metric Units.",2016-07-26,2016,[u'Iowa Department of Transportation'],ae64b466-71c0-4a99-bd25-8c41101a5d8c,,39.0151 -98.0603 44.7899 -98.0603 44.7899 -88.6958 39.0151 -88.6958 39.0151 -98.0603,2016,[u'Iowa DOT Open Data Portal'],2014InternationalRoughnessIndex_shp,39.0151 -98.0603 44.7899 -88.6958,"International Roughness Index: Iowa, 2014",Shapefile,"[u'Iowa, United States']",Iowa Department of Transportation (DOT),ae64b466-71c0-4a99-bd25-8c41101a5d8c,Dataset,
Mixed,2017-04-05T13:35:05Z,"ENVELOPE(-96.438, -96.364, 42.4935, 42.3895)","{""http://www.isotc211.org/schemas/2005/gmd/"":""https://opengeometadata.github.io/big-ten/97/9d/d6/c1ea0848328b0acd1df336bb01/iso19139.xml"",""urn:x-esri:serviceType:ArcGIS#DynamicMapLayer"":""https://gis.iowadot.gov/public/rest/services/Construction/Interstate29ConstructionRoads/MapServer/0"",""http://schema.org/downloadUrl"":""http://public.iowadot.opendata.arcgis.com/datasets/ad9d7b5e3bb9486c9709309ad156f3d1_0.zip""}",Public,979dd6c1-ea08-4832-8b0a-cd1df336bb01,Iowa,[u'Transportation'],"The I-29 project corridor is divided into three segments. These segments are being planned, designed and constructed separately. The data in this layer is designed to give you an interactive view of construction projects that MAY take place between 2015 and 2019 as part of the I-29 improvement project. The goal of the Interstate 29 improvement project is to enhance the safety and operation of Interstate 29 through Sioux City. Last updated: January 2015.",2015-11-09,2015,[u'Iowa Department of Transportation'],979dd6c1-ea08-4832-8b0a-cd1df336bb01,,42.3895 -96.438 42.4935 -96.438 42.4935 -96.364 42.3895 -96.364 42.3895 -96.438,2015,[u'Iowa DOT Open Data Portal'],Interstate29ConstructionRoads_shp,42.3895 -96.438 42.4935 -96.364,"Interstate 29 Construction Roads: Iowa, 2015",Shapefile,"[u'Iowa, United States']",Iowa Department of Transportation (DOT),979dd6c1-ea08-4832-8b0a-cd1df336bb01,Dataset,
Point,2017-04-05T13:35:54Z,"ENVELOPE(-96.4311, -90.4605, 42.6736, 40.6973)","{""http://schema.org/url"":""http://public.iowadot.opendata.arcgis.com/datasets/7b82f6f7dc0246ebbb9836bbc277be46_0"",""http://www.isotc211.org/schemas/2005/gmd/"":""https://opengeometadata.github.io/big-ten/8a/da/ac/9274c94aa69e3fc460216fafc2/iso19139.xml"",""urn:x-esri:serviceType:ArcGIS#DynamicMapLayer"":""https://gis.iowadot.gov/public/rest/services/Project_Scheduling/PSS_Public/MapServer/0"",""http://schema.org/downloadUrl"":""http://public.iowadot.opendata.arcgis.com/datasets/7b82f6f7dc0246ebbb9836bbc277be46_0.zip""}",Public,8adaac92-74c9-4aa6-9e3f-c460216fafc2,Iowa,[u'Transportation'],Iowa DOT project data from Project Scheduling System (PSS) for public use- bridge or structure project data.,2016-08-15,2016,[u'Iowa Department of Transportation'],8adaac92-74c9-4aa6-9e3f-c460216fafc2,,40.6973 -96.4311 42.6736 -96.4311 42.6736 -90.4605 40.6973 -90.4605 40.6973 -96.4311,2016,[u'Iowa DOT Open Data Portal'],ProjectSchedulingDataPoints_shp,40.6973 -96.4311 42.6736 -90.4605,Project Scheduling Data - Points: Iowa,Shapefile,"[u'Iowa, United States']",Iowa Department of Transportation (DOT),8adaac92-74c9-4aa6-9e3f-c460216fafc2,Dataset,
Mixed,2017-04-05T13:35:33Z,"ENVELOPE(-106.1923, -50.7553, 55.6587, 29.4667)","{""http://schema.org/url"":""http://public.iowadot.opendata.arcgis.com/datasets/c9ad71c73761431eb7a54fe275c18268_2"",""http://www.isotc211.org/schemas/2005/gmd/"":""https://opengeometadata.github.io/big-ten/60/cd/98/65e555401694ee3a7f8dfdfe3c/iso19139.xml"",""urn:x-esri:serviceType:ArcGIS#FeatureLayer"":""https://gis.iowadot.gov/public/rest/services/Right_of_Way/Right_Of_Way_Boundaries/FeatureServer/2"",""http://schema.org/downloadUrl"":""http://public.iowadot.opendata.arcgis.com/datasets/c9ad71c73761431eb7a54fe275c18268_2.zip""}",Public,60cd9865-e555-4016-94ee-3a7f8dfdfe3c,Iowa,[u'Transportation'],This layer displays Right of Way (ROW) parcels obtained by fee title- Required and Uneconomic Remnant.,2016-06-16,2016,[u'Iowa Department of Transportation'],60cd9865-e555-4016-94ee-3a7f8dfdfe3c,,29.4667 -106.1923 55.6587 -106.1923 55.6587 -50.7553 29.4667 -50.7553 29.4667 -106.1923,2016,[u'Iowa DOT Open Data Portal'],ROWLandAcquisitionFeeTitle_shp,29.4667 -106.1923 55.6587 -50.7553,ROW Land Acquisition - Fee Title: Iowa,Shapefile,"[u'Iowa, United States']",Iowa Department of Transportation (DOT),60cd9865-e555-4016-94ee-3a7f8dfdfe3c,Dataset,
Point,2017-04-05T13:35:09Z,"ENVELOPE(-97.3001, -89.197, 44.0521, 39.9267)","{""http://schema.org/url"":""http://public.iowadot.opendata.arcgis.com/datasets/032a445338be4654ac167f7df07edf02_2"",""http://www.isotc211.org/schemas/2005/gmd/"":""https://opengeometadata.github.io/big-ten/fa/d4/22/e5b36b4bc1b4ce6b87b27ea698/iso19139.xml"",""urn:x-esri:serviceType:ArcGIS#DynamicMapLayer"":""https://gis.iowadot.gov/public/rest/services/Maintenance/RWIS_Live/MapServer/2"",""http://schema.org/downloadUrl"":""http://public.iowadot.opendata.arcgis.com/datasets/032a445338be4654ac167f7df07edf02_2.zip""}",Public,fad422e5-b36b-4bc1-b4ce-6b87b27ea698,Iowa,[u'Transportation'],Live Roadway Weather Information System (RWIS) data feed- road conditions at RWIS stations.,2016-06-17,2016,[u'Iowa Department of Transportation'],fad422e5-b36b-4bc1-b4ce-6b87b27ea698,,39.9267 -97.3001 44.0521 -97.3001 44.0521 -89.197 39.9267 -89.197 39.9267 -97.3001,2016,[u'Iowa DOT Open Data Portal'],RWISDataRoadConditions_shp,39.9267 -97.3001 44.0521 -89.197,RWIS Data - Road Conditions: Iowa,Shapefile,"[u'Iowa, United States']",Iowa Department of Transportation (DOT),fad422e5-b36b-4bc1-b4ce-6b87b27ea698,Dataset,
Polygon,2017-04-05T13:34:53Z,"ENVELOPE(-96.6778, -90.0599, 43.5412, 40.3464)","{""http://schema.org/url"":""http://public.iowadot.opendata.arcgis.com/datasets/1e9d2072b5f746379d13c3d21627ab2c_0"",""http://www.isotc211.org/schemas/2005/gmd/"":""https://opengeometadata.github.io/big-ten/24/16/d2/f27ec348ce9def2c635321dbf6/iso19139.xml"",""urn:x-esri:serviceType:ArcGIS#FeatureLayer"":""https://gis.iowadot.gov/public/rest/services/Cadastre/PLSS_Boundary/FeatureServer/0"",""http://schema.org/downloadUrl"":""http://public.iowadot.opendata.arcgis.com/datasets/1e9d2072b5f746379d13c3d21627ab2c_0.zip""}",Public,2416d2f2-7ec3-48ce-9def-2c635321dbf6,Iowa,[u'Boundaries'],"The Public Land Survey System (PLSS) is a way of subdividing and describing land in the United States. The PLSS typically divides land into 6-mile-square townships. Each township is identified with a township and range designation. Township designations indicate the location north or south of the baseline, and range designations indicate the location east or west of the Principal Meridian. This map displays township boundaries. NOTE: Boundaries are only visible when zooming in on an area of the State. Warning: This dataset may not reflect legal boundary.",2016-07-22,2016,[u'Iowa Department of Transportation'],2416d2f2-7ec3-48ce-9def-2c635321dbf6,,40.3464 -96.6778 43.5412 -96.6778 43.5412 -90.0599 40.3464 -90.0599 40.3464 -96.6778,2016,[u'Iowa DOT Open Data Portal'],PLSSTownshipBoundaries_shp,40.3464 -96.6778 43.5412 -90.0599,PLSS Township Boundaries: Iowa,Shapefile,"[u'Iowa, United States']",Iowa Department of Transportation (DOT),2416d2f2-7ec3-48ce-9def-2c635321dbf6,Dataset,
Point,2017-04-05T13:35:25Z,"ENVELOPE(-95.660979, -92.431831, 43.510849, 41.404278)","{""http://schema.org/downloadUrl"":""ftp://ftp.igsb.uiowa.edu/gis_library/ia_state/infrastructure/electric/wind_turbines.zip"",""http://schema.org/url"":""ftp://ftp.igsb.uiowa.edu/gis_library/IA_State/Infrastructure/"",""http://www.isotc211.org/schemas/2005/gmd/"":""https://opengeometadata.github.io/big-ten/05/0a/75/d5e97947c499a6da4d0fdba8fe/iso19139.xml""}",Public,050a75d5-e979-47c4-99a6-da4d0fdba8fe,Iowa,"[u'Structure', u'Utilities and Communication', u'Wind farms', u'Wind turbines', u'Windmills']",This file represents the locations of wind turbines in Iowa. The data was originally provided by the Iowa Utilities Board. New locations are located from Windpower website and digitized off of aerial photography. This dataset can be linked to the Wind Farm dataset.,2009-11-12,2009,[u'Iowa Department of Natural Resources'],050a75d5-e979-47c4-99a6-da4d0fdba8fe,,41.404278 -95.660979 43.510849 -95.660979 43.510849 -92.431831 41.404278 -92.431831 41.404278 -95.660979,2009,[u'Iowa Geological Survey of the Iowa Department of Natural Resources'],,41.404278 -95.660979 43.510849 -92.431831,"Wind Turbine Locations: Iowa, 2009",Shapefile,"[u'Iowa, United States']",Iowa Department of Natural Resources (DNR),050a75d5-e979-47c4-99a6-da4d0fdba8fe,Dataset,
Point,2017-04-05T13:35:23Z,"ENVELOPE(-96.2143, -91.0774, 43.2887, 40.4488)","{""http://schema.org/url"":""http://public.iowadot.opendata.arcgis.com/datasets/03af1ffa3bd549b39157ad75c3eb8537_0"",""http://www.isotc211.org/schemas/2005/gmd/"":""https://opengeometadata.github.io/big-ten/a3/ee/17/bf0a054edf848adab2bee18c90/iso19139.xml"",""urn:x-esri:serviceType:ArcGIS#DynamicMapLayer"":""https://gis.iowadot.gov/public/rest/services/Aviation/AWOS/MapServer/0"",""http://schema.org/downloadUrl"":""http://public.iowadot.opendata.arcgis.com/datasets/03af1ffa3bd549b39157ad75c3eb8537_0.zip""}",Public,a3ee17bf-0a05-4edf-848a-dab2bee18c90,Iowa,[u'Transportation'],Live weather feed from Airport Automated Weather Observer System (AWOS) stations in Iowa.,2014-11-14,2014,[u'Iowa Department of Transportation'],a3ee17bf-0a05-4edf-848a-dab2bee18c90,,40.4488 -96.2143 43.2887 -96.2143 43.2887 -91.0774 40.4488 -91.0774 40.4488 -96.2143,2014,[u'Iowa DOT Open Data Portal'],LiveAWOSStations_shp,40.4488 -96.2143 43.2887 -91.0774,Live Automated Weather Observing System (AWOS) Stations: Iowa,Shapefile,"[u'Iowa, United States']",Iowa Department of Transportation (DOT),a3ee17bf-0a05-4edf-848a-dab2bee18c90,Dataset,
Mixed,2017-04-05T13:35:59Z,"ENVELOPE(-96.4976, -90.1116, 43.2096, 40.3615)","{""http://schema.org/url"":""http://public.iowadot.opendata.arcgis.com/datasets/d512bf82e82c4fcdac6d461177966792_17"",""http://www.isotc211.org/schemas/2005/gmd/"":""https://opengeometadata.github.io/big-ten/9e/10/9f/7841ff4fb795d84cf045e57bcd/iso19139.xml"",""urn:x-esri:serviceType:ArcGIS#FeatureLayer"":""https://gis.iowadot.gov/public/rest/services/Traffic/AADT_Turning_Traffic/FeatureServer/17"",""http://schema.org/downloadUrl"":""http://public.iowadot.opendata.arcgis.com/datasets/d512bf82e82c4fcdac6d461177966792_17.zip""}",Public,9e109f78-41ff-4fb7-95d8-4cf045e57bcd,Iowa,[u'Transportation'],"Iowa turning traffic data (AADT) for intersections on the primary, secondary and municipal roadway systems for 1998. The state is divided into 4 quadrants and each quadrant is counted every 4 years. The Turning Movements application includes all AADT Turning Traffic data for years 1998-2015 and can be found on the Iowa DOT Interactive Map Portal.",2016-09-28,2016,[u'Iowa Department of Transportation'],9e109f78-41ff-4fb7-95d8-4cf045e57bcd,,40.3615 -96.4976 43.2096 -96.4976 43.2096 -90.1116 40.3615 -90.1116 40.3615 -96.4976,2016,[u'Iowa DOT Open Data Portal'],AADTTurningTraffic1998_shp,40.3615 -96.4976 43.2096 -90.1116,"Annual Average Daily Traffic (AADT) Turning Traffic: Iowa, 1998",Shapefile,"[u'Iowa, United States']",Iowa Department of Transportation (DOT),9e109f78-41ff-4fb7-95d8-4cf045e57bcd,Dataset,
Point,2017-04-05T13:35:11Z,"ENVELOPE(-96.598504, -90.102669, 43.517496, 40.349114)","{""http://schema.org/downloadUrl"":""ftp://ftp.igsb.uiowa.edu/gis_library/ia_state/infrastructure/service_facilities_public.zip"",""http://schema.org/url"":""ftp://ftp.igsb.uiowa.edu/gis_library/IA_State/Infrastructure/"",""http://www.isotc211.org/schemas/2005/gmd/"":""https://opengeometadata.github.io/big-ten/4f/77/f6/667bf54ddb9d667795164b49af/iso19139.xml""}",Public,4f77f666-7bf5-4ddb-9d66-7795164b49af,Iowa,"[u'Economy', u'Health', u'Entertainment', u'Restaurant', u'Recreation', u'Economy', u'Retail', u'Food', u'Service', u'Hotel', u'Hospital', u'Arts', u'Health Care']","The data set is an Iowa employer address file containing GEO data for each location and other attributes of the business. These data were derived from the QCEW programs. IDNR Note: this data was provided by the State of Iowa Workforce Development agency, this dataset shows point locations of a subset of economic development data, including retail trade, information, health care and social assistance, arts / entertainment / recreation, and accommodation and food service.",2016-06,2006,[u'Iowa Department of Workforce Development'],4f77f666-7bf5-4ddb-9d66-7795164b49af,,40.349114 -96.598504 43.517496 -96.598504 43.517496 -90.102669 40.349114 -90.102669 40.349114 -96.598504,2006,[u'Iowa Geological Survey of the Iowa Department of Natural Resources'],,40.349114 -96.598504 43.517496 -90.102669,"Service Facilities (Business Locations), Public Version: Iowa, 2006",Shapefile,"[u'Iowa, United States']",Iowa Department of Natural Resources (DNR),4f77f666-7bf5-4ddb-9d66-7795164b49af,Dataset,
Mixed,2017-04-05T13:35:30Z,"ENVELOPE(-96.5428, -90.0755, 43.5105, 40.35)","{""http://schema.org/url"":""http://public.iowadot.opendata.arcgis.com/datasets/fb1b8ff4069f4362b9fb768630987459_0"",""http://www.isotc211.org/schemas/2005/gmd/"":""https://opengeometadata.github.io/big-ten/60/c6/06/ff42d34fc3ada38e6024b247e2/iso19139.xml"",""urn:x-esri:serviceType:ArcGIS#FeatureLayer"":""https://gis.iowadot.gov/public/rest/services/Boundaries/Urban_Areas/FeatureServer/0"",""http://schema.org/downloadUrl"":""http://public.iowadot.opendata.arcgis.com/datasets/fb1b8ff4069f4362b9fb768630987459_0.zip""}",Public,60c606ff-42d3-4fc3-ada3-8e6024b247e2,Iowa,[u'Transportation'],Iowa Urban Area boundaries from 2010.,2016-06-15,2016,[u'Iowa Department of Transportation'],60c606ff-42d3-4fc3-ada3-8e6024b247e2,,40.35 -96.5428 43.5105 -96.5428 43.5105 -90.0755 40.35 -90.0755 40.35 -96.5428,2016,[u'Iowa DOT Open Data Portal'],UrbanBoundaries_shp,40.35 -96.5428 43.5105 -90.0755,"Urban Boundaries: Iowa, 2010",Shapefile,"[u'Iowa, United States']",Iowa Department of Transportation (DOT),60c606ff-42d3-4fc3-ada3-8e6024b247e2,Dataset,
Point,2017-04-05T13:35:16Z,"ENVELOPE(-96.1773887951249, -90.3421269611815, 43.3735756237896, 40.5924217913547)","{""http://schema.org/url"":""http://public.iowadot.opendata.arcgis.com/datasets/6e10512857ca4569a9edc27f7d89ca58_0"",""http://www.isotc211.org/schemas/2005/gmd/"":""https://opengeometadata.github.io/big-ten/38/f9/38/c714ff4678a301d7b16285d444/iso19139.xml"",""urn:x-esri:serviceType:ArcGIS#FeatureLayer"":""https://services.arcgis.com/8lRhdTsQyJpO52F1/arcgis/rest/services/Salvage_Inspections/FeatureServer/0"",""http://schema.org/downloadUrl"":""http://public.iowadot.opendata.arcgis.com/datasets/6e10512857ca4569a9edc27f7d89ca58_0.zip""}",Public,38f938c7-14ff-4678-a301-d7b16285d444,Iowa,[u'Transportation'],Bureau of Investigations - Auto Vehicle Salvage Inspections Locations and Information. Full application on the Interactive Map Portal.,2016-06-15,2016,[u'Iowa Department of Transportation'],38f938c7-14ff-4678-a301-d7b16285d444,,40.5924217913547 -96.1773887951249 43.3735756237896 -96.1773887951249 43.3735756237896 -90.3421269611815 40.5924217913547 -90.3421269611815 40.5924217913547 -96.1773887951249,2016,[u'Iowa DOT Open Data Portal'],SalvageVehicleInspectionLocations_shp,40.5924217913547 -96.1773887951249 43.3735756237896 -90.3421269611815,Salvage Vehicle Inspection Locations: Iowa,Shapefile,"[u'Iowa, United States']",Iowa Department of Transportation (DOT),38f938c7-14ff-4678-a301-d7b16285d444,Dataset,
Point,2017-04-05T13:35:48Z,"ENVELOPE(-96.369827, -90.195215, 43.388507, 40.618845)","{""http://schema.org/downloadUrl"":""ftp://ftp.igsb.uiowa.edu/gis_library/IA_State/Infrastructure/municipal_landfills.zip"",""http://schema.org/url"":""ftp://ftp.igsb.uiowa.edu/gis_library/IA_State/Infrastructure/"",""http://www.isotc211.org/schemas/2005/gmd/"":""https://opengeometadata.github.io/big-ten/ac/77/d3/e27b584081bb38a5d738387fb6/iso19139.xml""}",Public,ac77d3e2-7b58-4081-bb38-a5d738387fb6,Iowa,"[u'Utilities and Communication', u'Landfills']",Municipal landfills in Iowa are included in this coverage.,1989,1989,[u'Calvin Wolter; Kathryne Clark'],ac77d3e2-7b58-4081-bb38-a5d738387fb6,,40.618845 -96.369827 43.388507 -96.369827 43.388507 -90.195215 40.618845 -90.195215 40.618845 -96.369827,1989,[u'Iowa Department of Natural Resources'],,40.618845 -96.369827 43.388507 -90.195215,"Municipal Landfills: Iowa, 1989",Shapefile,"[u'Iowa, United States']",Iowa Department of Natural Resources (DNR),ac77d3e2-7b58-4081-bb38-a5d738387fb6,Dataset,
Mixed,2017-04-05T13:35:51Z,"ENVELOPE(-95.8711, -90.6976, 43.5238, 41.1286)","{""http://schema.org/url"":""http://public.iowadot.opendata.arcgis.com/datasets/596bf72a6c754843ac02591e81ff5a72_2"",""http://www.isotc211.org/schemas/2005/gmd/"":""https://opengeometadata.github.io/big-ten/2b/eb/ca/11f23d427bb24bbec79d705533/iso19139.xml"",""urn:x-esri:serviceType:ArcGIS#FeatureLayer"":""https://services.arcgis.com/8lRhdTsQyJpO52F1/ArcGIS/rest/services/AllSystemsPermitCounty/FeatureServer/2"",""http://schema.org/downloadUrl"":""http://public.iowadot.opendata.arcgis.com/datasets/596bf72a6c754843ac02591e81ff5a72_2.zip""}",Public,2bebca11-f23d-427b-b24b-bec79d705533,Iowa,[u'Transportation'],"Displays counties where no county roads are restricted. Street-level restriction map can be found here: http://www.iowadot.gov/mvd/motorcarriers/systemmap.htm#county.Check with local officials when traveling on county roads or city streets for bridge embargo, detour, road embargo and vertical clearance information. State and interstate highways are valid routes except for restrictions listed on the bridge embargo, detour and road embargo, and vertical clearance maps located at http://www.iowadot.gov/mvd/motorcarriers/omcsMaps.htm.",2016-06-15,2016,[u'Iowa Department of Transportation'],2bebca11-f23d-427b-b24b-bec79d705533,,41.1286 -95.8711 43.5238 -95.8711 43.5238 -90.6976 41.1286 -90.6976 41.1286 -95.8711,2016,[u'Iowa DOT Open Data Portal'],AllSystemsPermitNoRestrictionsCountyLevel_shp,41.1286 -95.8711 43.5238 -90.6976,All Systems Permit (No Restrictions - County Level): Iowa,Shapefile,"[u'Iowa, United States']",Iowa Department of Transportation (DOT),2bebca11-f23d-427b-b24b-bec79d705533,Dataset,
Mixed,2017-04-05T13:35:21Z,"ENVELOPE(-98.0603, -88.6958, 44.7899, 39.0151)","{""http://schema.org/url"":""http://public.iowadot.opendata.arcgis.com/datasets/48bfff7ffbfa4555bed8c374e44c9300_13"",""http://www.isotc211.org/schemas/2005/gmd/"":""https://opengeometadata.github.io/big-ten/8f/45/e9/8aa19944fb803ff0f5711f6c35/iso19139.xml"",""urn:x-esri:serviceType:ArcGIS#FeatureLayer"":""https://gis.iowadot.gov/public/rest/services/Pavement_Management/Pavement/FeatureServer/13"",""http://schema.org/downloadUrl"":""http://public.iowadot.opendata.arcgis.com/datasets/48bfff7ffbfa4555bed8c374e44c9300_13.zip""}",Public,8f45e98a-a199-44fb-803f-f0f5711f6c35,Iowa,[u'Transportation'],"The Pavement Management Information Systems (PMIS) from 2011 through 2015 contains various levels of data on the pavement condition and history of Iowa Interstate and Primary routes. The data was collected by a 3rd party vendor and processed by the Iowa Department of Transportation. Starting in 2013, the data is reported in English Units instead of Metric Units.",2016-07-26,2016,[u'Iowa Department of Transportation'],8f45e98a-a199-44fb-803f-f0f5711f6c35,,39.0151 -98.0603 44.7899 -98.0603 44.7899 -88.6958 39.0151 -88.6958 39.0151 -98.0603,2016,[u'Iowa DOT Open Data Portal'],2014PavementFriction_shp,39.0151 -98.0603 44.7899 -88.6958,"Pavement Friction: Iowa, 2014",Shapefile,"[u'Iowa, United States']",Iowa Department of Transportation (DOT),8f45e98a-a199-44fb-803f-f0f5711f6c35,Dataset,
Mixed,2017-04-05T13:35:35Z,"ENVELOPE(-96.5233, -90.1098, 43.4995, 40.5295)","{""http://schema.org/url"":""http://public.iowadot.opendata.arcgis.com/datasets/c0d72a59bce7463bbad719787e5279a8_1"",""http://www.isotc211.org/schemas/2005/gmd/"":""https://opengeometadata.github.io/big-ten/9b/bb/77/f552ab482e895c4f31228e4502/iso19139.xml"",""urn:x-esri:serviceType:ArcGIS#DynamicMapLayer"":""https://gis.iowadot.gov/public/rest/services/Project_Scheduling/PSS_Public/MapServer/1"",""http://schema.org/downloadUrl"":""http://public.iowadot.opendata.arcgis.com/datasets/c0d72a59bce7463bbad719787e5279a8_1.zip""}",Public,9bbb77f5-52ab-482e-895c-4f31228e4502,Iowa,[u'Transportation'],Iowa DOT project data from Project Scheduling System (PSS) for public use- linear project data.,2015-05-01,2015,[u'Iowa Department of Transportation'],9bbb77f5-52ab-482e-895c-4f31228e4502,,40.5295 -96.5233 43.4995 -96.5233 43.4995 -90.1098 40.5295 -90.1098 40.5295 -96.5233,2015,[u'Iowa DOT Open Data Portal'],ProjectSchedulingDataLines_shp,40.5295 -96.5233 43.4995 -90.1098,Project Scheduling Data - Lines: Iowa,Shapefile,"[u'Iowa, United States']",Iowa Department of Transportation (DOT),9bbb77f5-52ab-482e-895c-4f31228e4502,Dataset,
Point,2017-04-05T13:35:05Z,"ENVELOPE(-96.5124, -90.09, 43.477, 40.5744)","{""http://schema.org/url"":""http://public.iowadot.opendata.arcgis.com/datasets/647a49f17f634f7e985945698494e4fd_0"",""http://www.isotc211.org/schemas/2005/gmd/"":""https://opengeometadata.github.io/big-ten/4a/7b/f1/049377462eb3491e06b73126c7/iso19139.xml"",""urn:x-esri:serviceType:ArcGIS#FeatureLayer"":""https://services.arcgis.com/8lRhdTsQyJpO52F1/ArcGIS/rest/services/Lidar_Locator/FeatureServer/0"",""http://schema.org/downloadUrl"":""http://public.iowadot.opendata.arcgis.com/datasets/647a49f17f634f7e985945698494e4fd_0.zip""}",Public,4a7bf104-9377-462e-b349-1e06b73126c7,Iowa,[u'Structure'],This map displays the locations and information for structures located using LiDAR.,2016-06-12,2016,[u'Iowa Department of Transportation'],4a7bf104-9377-462e-b349-1e06b73126c7,,40.5744 -96.5124 43.477 -96.5124 43.477 -90.09 40.5744 -90.09 40.5744 -96.5124,2016,[u'Iowa DOT Open Data Portal'],LiDARStructureLocator_shp,40.5744 -96.5124 43.477 -90.09,LiDAR Structure Locator: Iowa,Shapefile,"[u'Iowa, United States']",Iowa Department of Transportation (DOT),4a7bf104-9377-462e-b349-1e06b73126c7,Dataset,
