layer_geom_type_s,layer_modified_dt,solr_geom,dct_references_s,dc_rights_s,uuid,dct_provenance_s,dc_subject_sm,dc_description_s,dct_issued_s,dct_temporal_sm,dc_creator_sm,dc_identifier_s,dc_relation_sm,georss_polygon_s,solr_year_i,dc_publisher_sm,layer_id_s,georss_box_s,dc_title_s,dc_format_s,dct_spatial_sm,dct_isPartOf_sm,layer_slug_s,dc_type_s,dc_source_sm
Point,2017-04-05T13:35:28Z,"ENVELOPE(-96.396047, -90.184526, 42.661887, 41.535824)","{""http://schema.org/downloadUrl"":""ftp://ftp.igsb.uiowa.edu/gis_library/ia_state/infrastructure/rendering_facilities.zip"",""http://schema.org/url"":""ftp://ftp.igsb.uiowa.edu/gis_library/IA_State/Infrastructure/"",""http://www.isotc211.org/schemas/2005/gmd/"":""https://opengeometadata.github.io/big-ten/13/98/7b/35db34414daae34f1f67079132/iso19139.xml""}",Public,13987b35-db34-414d-aae3-4f1f67079132,Iowa,[u'Structure'],This file contains locations of known facilities where the rendering process takes place in Iowa. It does not include transfer stations or call-in locations.,2016-02,2005,[u'Kathryne Clark'],13987b35-db34-414d-aae3-4f1f67079132,,41.535824 -96.396047 42.661887 -96.396047 42.661887 -90.184526 41.535824 -90.184526 41.535824 -96.396047,2005,"[u'Iowa DNR, Geological Survey']",,41.535824 -96.396047 42.661887 -90.184526,"Animal Rendering Facilities: Iowa, 2005",Shapefile,"[u'Iowa, United States']",Iowa Department of Natural Resources (DNR),13987b35-db34-414d-aae3-4f1f67079132,Dataset,
Mixed,2017-04-05T13:35:57Z,"ENVELOPE(-96.4849, -90.2032, 43.5009, 40.4028)","{""http://schema.org/url"":""http://public.iowadot.opendata.arcgis.com/datasets/b953af80fcc442e48c39b0093b55f71e_5"",""http://www.isotc211.org/schemas/2005/gmd/"":""https://opengeometadata.github.io/big-ten/7e/d1/61/7f4bc5410c93b8994c52737a4c/iso19139.xml"",""urn:x-esri:serviceType:ArcGIS#FeatureLayer"":""https://gis.iowadot.gov/public/rest/services/Aviation/Airport_Part77_Surfaces/FeatureServer/5"",""http://schema.org/downloadUrl"":""http://public.iowadot.opendata.arcgis.com/datasets/b953af80fcc442e48c39b0093b55f71e_5.zip""}",Public,7ed1617f-4bc5-410c-93b8-994c52737a4c,Iowa,[u'Transportation'],The Horizontal surface is a plane 150  above the established airport elevation. The perimeter of which is constructed by swinging arcs of specified radii from the center of each end of the primary surface and connecting adjacent arcs by lines tangent to those arcs.,2016-06-12,2016,[u'Iowa Department of Transportation'],7ed1617f-4bc5-410c-93b8-994c52737a4c,,40.4028 -96.4849 43.5009 -96.4849 43.5009 -90.2032 40.4028 -90.2032 40.4028 -96.4849,2016,[u'Iowa DOT Open Data Portal'],AirportPart77SurfacesHorizontal_shp,40.4028 -96.4849 43.5009 -90.2032,Airport Part 77 Surfaces - Horizontal: Iowa,Shapefile,"[u'Iowa, United States']",Iowa Department of Transportation (DOT),7ed1617f-4bc5-410c-93b8-994c52737a4c,Dataset,
Point,2017-04-05T13:35:37Z,"ENVELOPE(-96.8425, -89.4309, 43.739, 39.4263)","{""http://schema.org/url"":""http://public.iowadot.opendata.arcgis.com/datasets/e4a6ba5316564f9e89d488c5adc18377_9"",""http://www.isotc211.org/schemas/2005/gmd/"":""https://opengeometadata.github.io/big-ten/e0/d0/99/8755624b349ae23d4a5cba4261/iso19139.xml"",""urn:x-esri:serviceType:ArcGIS#DynamicMapLayer"":""https://gis.iowadot.gov/public/rest/services/Facilities/IaDOT_Statewide_Rest_Area/MapServer/9"",""http://schema.org/downloadUrl"":""http://public.iowadot.opendata.arcgis.com/datasets/e4a6ba5316564f9e89d488c5adc18377_9.zip""}",Public,e0d09987-5562-4b34-9ae2-3d4a5cba4261,Iowa,[u'Transportation'],Iowa Department of Transportation statewide rest area data. This layer displays full service locations with truck parking.,2016-08-19,2016,[u'Iowa Department of Transportation'],e0d09987-5562-4b34-9ae2-3d4a5cba4261,,39.4263 -96.8425 43.739 -96.8425 43.739 -89.4309 39.4263 -89.4309 39.4263 -96.8425,2016,[u'Iowa DOT Open Data Portal'],TruckParkingLocationsFullService_shp,39.4263 -96.8425 43.739 -89.4309,Truck Parking Locations - Full Service: Iowa,Shapefile,"[u'Iowa, United States']",Iowa Department of Transportation (DOT),e0d09987-5562-4b34-9ae2-3d4a5cba4261,Dataset,
Mixed,2017-04-05T13:35:40Z,"ENVELOPE(-96.6695, -90.0866, 43.5389, 40.3572)","{""http://schema.org/url"":""http://public.iowadot.opendata.arcgis.com/datasets/09f912e219c149ada01add96679539d3_2"",""http://www.isotc211.org/schemas/2005/gmd/"":""https://opengeometadata.github.io/big-ten/cd/d9/b7/fc95414adf9bee9e765f1d5895/iso19139.xml"",""urn:x-esri:serviceType:ArcGIS#FeatureLayer"":""https://gis.iowadot.gov/public/rest/services/Traffic_Safety/Access_Priority_Classification/FeatureServer/2"",""http://schema.org/downloadUrl"":""http://public.iowadot.opendata.arcgis.com/datasets/09f912e219c149ada01add96679539d3_2.zip""}",Public,cdd9b7fc-9541-4adf-9bee-9e765f1d5895,Iowa,[u'Transportation'],"The Iowa DOT has established an access management policy to control access to the Primary Highway System. Access Priority Level 3 is for four-lane rural highways with access at interchanges and selected at-grade locations - 1,000 foot minimum, 1/4 mile preferred spacing.",2016-06-16,2016,[u'Iowa Department of Transportation'],cdd9b7fc-9541-4adf-9bee-9e765f1d5895,,40.3572 -96.6695 43.5389 -96.6695 43.5389 -90.0866 40.3572 -90.0866 40.3572 -96.6695,2016,[u'Iowa DOT Open Data Portal'],HighwayAccessManagementPriority3_shp,40.3572 -96.6695 43.5389 -90.0866,Highway Access Management - Priority 3: Iowa,Shapefile,"[u'Iowa, United States']",Iowa Department of Transportation (DOT),cdd9b7fc-9541-4adf-9bee-9e765f1d5895,Dataset,
Mixed,2017-04-05T13:35:12Z,"ENVELOPE(-96.676474, -90.093225, 43.556969, 40.339744)","{""http://schema.org/url"":""ftp://ftp.igsb.uiowa.edu/gis_library/IA_State/Infrastructure/"",""http://www.isotc211.org/schemas/2005/gmd/"":""https://opengeometadata.github.io/big-ten/1d/7c/bc/a8ba764c528ddf3c8abbafb430/iso19139.xml""}",Public,1d7cbca8-ba76-4c52-8ddf-3c8abbafb430,Iowa,[u'Transportation'],This coverage consists of all the individual 99 county roads 2000 TIGER shapefiles appended together into a statewide database.,2001-12-31,2001,[u'U.S. Department of Commerce U.S. Census Bureau Geography Division'],1d7cbca8-ba76-4c52-8ddf-3c8abbafb430,,40.339744 -96.676474 43.556969 -96.676474 43.556969 -90.093225 40.339744 -90.093225 40.339744 -96.676474,2001,[u'U.S. Department of Commerce U.S. Census Bureau Geography Division'],,40.339744 -96.676474 43.556969 -90.093225,"Roads: Iowa, 2001",Shapefile,"[u'Iowa, United States']",Iowa Department of Natural Resources (DNR),1d7cbca8-ba76-4c52-8ddf-3c8abbafb430,Dataset,
Point,2017-04-05T13:35:29Z,"ENVELOPE(-96.5211, -90.2839, 43.4474, 40.5779)","{""http://schema.org/url"":""http://public.iowadot.opendata.arcgis.com/datasets/fb85dbc0004c46f29367c59815066c68_24"",""http://www.isotc211.org/schemas/2005/gmd/"":""https://opengeometadata.github.io/big-ten/d5/05/ec/01138247e59d625824fcc93f61/iso19139.xml"",""urn:x-esri:serviceType:ArcGIS#DynamicMapLayer"":""https://gis.iowadot.gov/public/rest/services/Facilities/IaDOT_Statewide_Rest_Area/MapServer/24"",""http://schema.org/downloadUrl"":""http://public.iowadot.opendata.arcgis.com/datasets/fb85dbc0004c46f29367c59815066c68_24.zip""}",Public,d505ec01-1382-47e5-9d62-5824fcc93f61,Iowa,[u'Transportation'],"Iowa Department of Transportation statewide rest area data. This layer displays alternative service locations that have 24-hour restrooms, truck parking and traveler information.",2016-08-19,2016,[u'Iowa Department of Transportation'],d505ec01-1382-47e5-9d62-5824fcc93f61,,40.5779 -96.5211 43.4474 -96.5211 43.4474 -90.2839 40.5779 -90.2839 40.5779 -96.5211,2016,[u'Iowa DOT Open Data Portal'],AlternativeServiceLocations24HourRestroomTruckParkingTravelerInformation_shp,40.5779 -96.5211 43.4474 -90.2839,"Alternative Service Locations - 24-Hour Restroom, Truck Parking &amp; Traveler Information: Iowa",Shapefile,"[u'Iowa, United States']",Iowa Department of Transportation (DOT),d505ec01-1382-47e5-9d62-5824fcc93f61,Dataset,
Mixed,2017-04-05T13:35:47Z,"ENVELOPE(-96.6695, -90.0866, 43.5389, 40.3572)","{""http://schema.org/url"":""http://public.iowadot.opendata.arcgis.com/datasets/01bd0067ada94e0a8d432c1eb5bd3ca1_1"",""http://www.isotc211.org/schemas/2005/gmd/"":""https://opengeometadata.github.io/big-ten/3f/7d/20/f0581244d2b13b61938c1ad16b/iso19139.xml"",""urn:x-esri:serviceType:ArcGIS#FeatureLayer"":""https://gis.iowadot.gov/public/rest/services/Traffic_Safety/Access_Priority_Classification/FeatureServer/1"",""http://schema.org/downloadUrl"":""http://public.iowadot.opendata.arcgis.com/datasets/01bd0067ada94e0a8d432c1eb5bd3ca1_1.zip""}",Public,3f7d20f0-5812-44d2-b13b-61938c1ad16b,Iowa,[u'Transportation'],"The Iowa DOT has established an access management policy to control access to the Primary Highway System. Access Priority Level 2 is for four-lane rural highways with access at interchanges and selected at-grade locations - 1/2 mile minimum, 1 mile preferred spacing.",2016-06-16,2016,[u'Iowa Department of Transportation'],3f7d20f0-5812-44d2-b13b-61938c1ad16b,,40.3572 -96.6695 43.5389 -96.6695 43.5389 -90.0866 40.3572 -90.0866 40.3572 -96.6695,2016,[u'Iowa DOT Open Data Portal'],HighwayAccessManagementPriority2_shp,40.3572 -96.6695 43.5389 -90.0866,Highway Access Management - Priority 2: Iowa,Shapefile,"[u'Iowa, United States']",Iowa Department of Transportation (DOT),3f7d20f0-5812-44d2-b13b-61938c1ad16b,Dataset,
Mixed,2017-04-05T13:35:13Z,"ENVELOPE(-95.6454, -91.0986, 42.4938, 40.8532)","{""http://schema.org/url"":""http://public.iowadot.opendata.arcgis.com/datasets/8875b291465c4af4b246e5d5eff6f201_3"",""http://www.isotc211.org/schemas/2005/gmd/"":""https://opengeometadata.github.io/big-ten/44/d9/61/c5cb074424951cecd444c0737d/iso19139.xml"",""urn:x-esri:serviceType:ArcGIS#FeatureLayer"":""https://gis.iowadot.gov/public/rest/services/Right_of_Way/Right_Of_Way_Boundaries/FeatureServer/3"",""http://schema.org/downloadUrl"":""http://public.iowadot.opendata.arcgis.com/datasets/8875b291465c4af4b246e5d5eff6f201_3.zip""}",Public,44d961c5-cb07-4424-951c-ecd444c0737d,Iowa,[u'Transportation'],This layer displays Right of Way (ROW) parcels obtained as excess (fee).,2016-06-16,2016,[u'Iowa Department of Transportation'],44d961c5-cb07-4424-951c-ecd444c0737d,,40.8532 -95.6454 42.4938 -95.6454 42.4938 -91.0986 40.8532 -91.0986 40.8532 -95.6454,2016,[u'Iowa DOT Open Data Portal'],ROWLandAcquisitionExcess_shp,40.8532 -95.6454 42.4938 -91.0986,ROW Land Acquisition - Excess: Iowa,Shapefile,"[u'Iowa, United States']",Iowa Department of Transportation (DOT),44d961c5-cb07-4424-951c-ecd444c0737d,Dataset,
Mixed,2017-04-05T13:35:26Z,"ENVELOPE(-96.6424, -90.8981, 43.4895, 41.2291)","{""http://schema.org/url"":""http://public.iowadot.opendata.arcgis.com/datasets/a43a0613ee5a4c09930a360fe5aec93c_0"",""http://www.isotc211.org/schemas/2005/gmd/"":""https://opengeometadata.github.io/big-ten/8d/d8/19/74247246f487a5ccc3f826e4ac/iso19139.xml"",""urn:x-esri:serviceType:ArcGIS#FeatureLayer"":""https://gis.iowadot.gov/public/rest/services/Traffic/AADT_Turning_Traffic/FeatureServer/0"",""http://schema.org/downloadUrl"":""http://public.iowadot.opendata.arcgis.com/datasets/a43a0613ee5a4c09930a360fe5aec93c_0.zip""}",Public,8dd81974-2472-46f4-87a5-ccc3f826e4ac,Iowa,[u'Transportation'],"Iowa turning traffic data (AADT) for intersections on the primary, secondary and municipal roadway systems for 2015. The state is divided into 4 quadrants and each quadrant is counted every 4 years.The Turning Movements application includes all AADT Turning Traffic data for years 1998-2015 and can be found on the Iowa DOT Interactive Map Portal.",2016-09-27,2016,[u'Iowa Department of Transportation'],8dd81974-2472-46f4-87a5-ccc3f826e4ac,,41.2291 -96.6424 43.4895 -96.6424 43.4895 -90.8981 41.2291 -90.8981 41.2291 -96.6424,2016,[u'Iowa DOT Open Data Portal'],AADTTurningTraffic2015_shp,41.2291 -96.6424 43.4895 -90.8981,"Annual Average Daily Traffic (AADT) Turning Traffic: Iowa, 2015",Shapefile,"[u'Iowa, United States']",Iowa Department of Transportation (DOT),8dd81974-2472-46f4-87a5-ccc3f826e4ac,Dataset,
Point,2017-04-05T13:35:02Z,"ENVELOPE(-96.5211, -90.2839, 43.4474, 40.5779)","{""http://schema.org/url"":""http://public.iowadot.opendata.arcgis.com/datasets/722fbddd893f4e8288605146bba0c807_29"",""http://www.isotc211.org/schemas/2005/gmd/"":""https://opengeometadata.github.io/big-ten/bc/88/cd/2ea93b4334889a4ff8e795750b/iso19139.xml"",""urn:x-esri:serviceType:ArcGIS#DynamicMapLayer"":""https://gis.iowadot.gov/public/rest/services/Facilities/IaDOT_Statewide_Rest_Area/MapServer/29"",""http://schema.org/downloadUrl"":""http://public.iowadot.opendata.arcgis.com/datasets/722fbddd893f4e8288605146bba0c807_29.zip""}",Public,bc88cd2e-a93b-4334-889a-4ff8e795750b,Iowa,[u'Transportation'],Iowa Department of Transportation statewide rest area data. This layer displays alternative service locations that have truck parking.,2016-08-19,2016,[u'Iowa Department of Transportation'],bc88cd2e-a93b-4334-889a-4ff8e795750b,,40.5779 -96.5211 43.4474 -96.5211 43.4474 -90.2839 40.5779 -90.2839 40.5779 -96.5211,2016,[u'Iowa DOT Open Data Portal'],AlternativeServiceLocationsTruckParking_shp,40.5779 -96.5211 43.4474 -90.2839,Alternative Service Locations - Truck Parking: Iowa,Shapefile,"[u'Iowa, United States']",Iowa Department of Transportation (DOT),bc88cd2e-a93b-4334-889a-4ff8e795750b,Dataset,
Mixed,2017-04-05T13:35:04Z,"ENVELOPE(-96.6465, -90.0787, 43.5218, 40.3501)","{""http://schema.org/url"":""http://public.iowadot.opendata.arcgis.com/datasets/7ddde46d987242b3860bf7f5d4a1b382_9"",""http://www.isotc211.org/schemas/2005/gmd/"":""https://opengeometadata.github.io/big-ten/42/ba/89/84ea4049959011d6b50e2c65cd/iso19139.xml"",""urn:x-esri:serviceType:ArcGIS#FeatureLayer"":""https://gis.iowadot.gov/public/rest/services/Traffic_Safety/SICL/FeatureServer/9"",""http://schema.org/downloadUrl"":""http://public.iowadot.opendata.arcgis.com/datasets/7ddde46d987242b3860bf7f5d4a1b382_9.zip""}",Public,42ba8984-ea40-4995-9011-d6b50e2c65cd,Iowa,[u'Transportation'],"Crash history by city. Identifies number of crashes and injuries on a city by city basis going back to 2001. The Iowa DOT's Office of Traffic and Safety has updated a list of the top 1000 intersection safety improvement candidate locations (SICL) in Iowa. This list is supplemental to Iowa DOT's primary focus, Iowa's 5 Percent Safety Report. To develop this list, all crashes in Iowa are used to determine an initial cut of intersections that meet the criteria of at least one crash. The intersections identified are then ranked according to the number of crashes, the severity of the crashes, and the rate at which crashes occur. To read more details regarding Iowa's SICL, see Iowa SICL method. The Iowa DOT utilizes crash reports filed by city police departments, county sheriffs, the Iowa State Patrol and individual drivers in determining the listings. The locations identified are eligible for funding assistance to develop safety improvements under the Iowa Traffic Safety Fund Program. Grant applications for funding are competitive and subject to comparison with the 5 percent severe safety needs list. The Iowa DOT will select proposals that provide the greatest safety return on the dollars invested. Proposals must be submitted to the Iowa DOT by June 15th each year to qualify for funding the following year. The Iowa Transportation Commission will consider and approve funding for selected locations during November and December. For more detail, please see: http://www.iowadot.gov/crashanalysis/top200.htm.",2016-06-17,2016,[u'Iowa Department of Transportation'],42ba8984-ea40-4995-9011-d6b50e2c65cd,,40.3501 -96.6465 43.5218 -96.6465 43.5218 -90.0787 40.3501 -90.0787 40.3501 -96.6465,2016,[u'Iowa DOT Open Data Portal'],CityTrafficCrashStatisticsSICL_shp,40.3501 -96.6465 43.5218 -90.0787,City Traffic Crash Statistics (SICL): Iowa,Shapefile,"[u'Iowa, United States']",Iowa Department of Transportation (DOT),42ba8984-ea40-4995-9011-d6b50e2c65cd,Dataset,
Mixed,2017-04-05T13:34:56Z,"ENVELOPE(-96.67840746043, -90.0590056591723, 43.5416684130343, 40.3460073869274)","{""http://schema.org/url"":""http://public.iowadot.opendata.arcgis.com/datasets/bfa1c4ee871a475c8ee60a6843545c8d_0"",""http://www.isotc211.org/schemas/2005/gmd/"":""https://opengeometadata.github.io/big-ten/f4/49/83/08416e4fe38e7d3ae048471e3f/iso19139.xml"",""urn:x-esri:serviceType:ArcGIS#FeatureLayer"":""https://services.arcgis.com/8lRhdTsQyJpO52F1/arcgis/rest/services/Motor_Vehicle_Enforcement_Districts/FeatureServer/0"",""http://schema.org/downloadUrl"":""http://public.iowadot.opendata.arcgis.com/datasets/bfa1c4ee871a475c8ee60a6843545c8d_0.zip""}",Public,f4498308-416e-4fe3-8e7d-3ae048471e3f,Iowa,[u'Transportation'],Map shows the Motor Vehicle Enforcement Districts and the number of LiDAR units associated with each. Uses a feature layer published directly to ArcOnline named Motor Vehicle Enforcement Districts. Data is driven via shapefile maintained by Cartography.,2016-06-16,2016,[u'Iowa Department of Transportation'],f4498308-416e-4fe3-8e7d-3ae048471e3f,,40.3460073869274 -96.67840746043 43.5416684130343 -96.67840746043 43.5416684130343 -90.0590056591723 40.3460073869274 -90.0590056591723 40.3460073869274 -96.67840746043,2016,[u'Iowa DOT Open Data Portal'],MotorVehicleEnforcementDistricts_shp,40.3460073869274 -96.67840746043 43.5416684130343 -90.0590056591723,Motor Vehicle Enforcement Districts: Iowa,Shapefile,"[u'Iowa, United States']",Iowa Department of Transportation (DOT),f4498308-416e-4fe3-8e7d-3ae048471e3f,Dataset,
Point,2017-04-05T13:35:07Z,"ENVELOPE(-96.4252, -90.1197, 43.3595, 40.7195)","{""urn:x-esri:serviceType:ArcGIS#FeatureLayer"":""https://gis.iowadot.gov/public/rest/services/Systems_Planning/Freight/FeatureServer/7"",""http://www.isotc211.org/schemas/2005/gmd/"":""https://opengeometadata.github.io/big-ten/04/f6/07/6c0b5c42478f419121b393b669/iso19139.xml"",""http://schema.org/url"":""http://public.iowadot.opendata.arcgis.com/datasets/1e630dd30ade417bb34c6421938e4a32_7"",""http://schema.org/downloadUrl"":""http://public.iowadot.opendata.arcgis.com/datasets/1e630dd30ade417bb34c6421938e4a32_7.zip""}",Public,04f6076c-0b5c-4247-8f41-9121b393b669,Iowa,[u'Transportation'],This layer depicts the coal burning facilities in the state. Note: not all of the facilities have access to a railroad.,2016-06-16,2016,[u'Iowa Department of Transportation'],04f6076c-0b5c-4247-8f41-9121b393b669,,40.7195 -96.4252 43.3595 -96.4252 43.3595 -90.1197 40.7195 -90.1197 40.7195 -96.4252,2016,[u'Iowa DOT Open Data Portal'],FreightCoalBurningFacilities_shp,40.7195 -96.4252 43.3595 -90.1197,Freight - Coal Burning Facilities: Iowa,Shapefile,"[u'Iowa, United States']",Iowa Department of Transportation (DOT),04f6076c-0b5c-4247-8f41-9121b393b669,Dataset,
Mixed,2017-04-05T13:35:22Z,"ENVELOPE(-96.672623, -90.100814, 43.486988, 40.345315)","{""http://schema.org/downloadUrl"":""ftp://ftp.igsb.uiowa.edu/gis_library/ia_state/infrastructure/levee_centerlines.zip"",""http://schema.org/url"":""ftp://ftp.igsb.uiowa.edu/gis_library/IA_State/Infrastructure/"",""http://www.isotc211.org/schemas/2005/gmd/"":""https://opengeometadata.github.io/big-ten/08/4b/e3/121604432fa65e5ffc07171681/iso19139.xml""}",Public,084be312-1604-432f-a65e-5ffc07171681,Iowa,"[u'Structure', u'Levee Centerline', u'Levee']","A levee, leve, dike (or dyke), embankment, floodbank or stopbank is a natural or artificial slope or wall to regulate water levels. It is usually earthen and often parallel to the course of a river or the coast. (Henry Petroski (2006). Levees and Other Raised Ground. 94. American Scientist. pp. 7-11) This layer represents levees in Iowa. This dataset was derived from USGS Topo Sheets, LiDAR data, Aerial photography, coverage made in a post 1993-flood study, and the National Levee Database.",1994,2007-2009,[u'Iowa Department of Natural Resources'],084be312-1604-432f-a65e-5ffc07171681,,40.345315 -96.672623 43.486988 -96.672623 43.486988 -90.100814 40.345315 -90.100814 40.345315 -96.672623,2007,"[u'Iowa Geological and Water Survey, DNR']",,40.345315 -96.672623 43.486988 -90.100814,"Levee Centerlines: Iowa, 2007",Shapefile,"[u'Iowa, United States']",Iowa Department of Natural Resources (DNR),084be312-1604-432f-a65e-5ffc07171681,Dataset,
Mixed,2017-04-05T13:35:35Z,"ENVELOPE(-96.6392, -90.0762, 43.5203, 40.9569)","{""http://schema.org/url"":""http://public.iowadot.opendata.arcgis.com/datasets/270e49e656814c218d1b828a8dd8be31_12"",""http://www.isotc211.org/schemas/2005/gmd/"":""https://opengeometadata.github.io/big-ten/54/06/87/0eb50d43ef9ba9da00dac15e04/iso19139.xml"",""urn:x-esri:serviceType:ArcGIS#FeatureLayer"":""https://gis.iowadot.gov/public/rest/services/Traffic/AADT_Turning_Traffic/FeatureServer/12"",""http://schema.org/downloadUrl"":""http://public.iowadot.opendata.arcgis.com/datasets/270e49e656814c218d1b828a8dd8be31_12.zip""}",Public,5406870e-b50d-43ef-9ba9-da00dac15e04,Iowa,[u'Transportation'],"Iowa turning traffic data (AADT) for intersections on the primary, secondary and municipal roadway systems for 2003. The state is divided into 4 quadrants and each quadrant is counted every 4 years.The Turning Movements application includes all AADT Turning Traffic data for years 1998-2015 and can be found on the Iowa DOT Interactive Map Portal.",2016-09-29,2016,[u'Iowa Department of Transportation'],5406870e-b50d-43ef-9ba9-da00dac15e04,,40.9569 -96.6392 43.5203 -96.6392 43.5203 -90.0762 40.9569 -90.0762 40.9569 -96.6392,2016,[u'Iowa DOT Open Data Portal'],AADTTurningTraffic2003_shp,40.9569 -96.6392 43.5203 -90.0762,"Annual Average Daily Traffic (AADT) Turning Traffic: Iowa, 2003",Shapefile,"[u'Iowa, United States']",Iowa Department of Transportation (DOT),5406870e-b50d-43ef-9ba9-da00dac15e04,Dataset,
Mixed,2017-04-05T13:34:55Z,"ENVELOPE(-96.629488, -90.086723, 43.547944, 40.400998)","{""http://schema.org/downloadUrl"":""ftp://ftp.igsb.uiowa.edu/gis_library/ia_state/infrastructure/major_pipelines.zip"",""http://schema.org/url"":""ftp://ftp.igsb.uiowa.edu/gis_library/IA_State/Infrastructure/"",""http://www.isotc211.org/schemas/2005/gmd/"":""https://opengeometadata.github.io/big-ten/9b/c6/5b/6075554f56952e350cc4396cc0/iso19139.xml""}",Public,9bc65b60-7555-4f56-952e-350cc4396cc0,Iowa,"[u'Utilities and Communication', u'Pipelines']",This dataset represents major pipelines that have been digitized from DOT Highway and Transportation Maps.,2007-10-01,2007,[u'Iowa Department of Natural Resources'],9bc65b60-7555-4f56-952e-350cc4396cc0,,40.400998 -96.629488 43.547944 -96.629488 43.547944 -90.086723 40.400998 -90.086723 40.400998 -96.629488,2007,"[u'Iowa Geological Survey, DNR']",,40.400998 -96.629488 43.547944 -90.086723,"Major Pipelines Traversing the State: Iowa, 2007",Shapefile,"[u'Iowa, United States']",Iowa Department of Natural Resources (DNR),9bc65b60-7555-4f56-952e-350cc4396cc0,Dataset,
Point,2017-04-05T13:35:48Z,"ENVELOPE(-96.5211, -90.2839, 43.4474, 40.5779)","{""http://schema.org/url"":""http://public.iowadot.opendata.arcgis.com/datasets/17296a72650043e09394a6152cdb6b9d_13"",""http://www.isotc211.org/schemas/2005/gmd/"":""https://opengeometadata.github.io/big-ten/93/d2/40/9fa9b24235979633a13bb438ed/iso19139.xml"",""urn:x-esri:serviceType:ArcGIS#DynamicMapLayer"":""https://gis.iowadot.gov/public/rest/services/Facilities/IaDOT_Statewide_Rest_Area/MapServer/13"",""http://schema.org/downloadUrl"":""http://public.iowadot.opendata.arcgis.com/datasets/17296a72650043e09394a6152cdb6b9d_13.zip""}",Public,93d2409f-a9b2-4235-9796-33a13bb438ed,Iowa,[u'Transportation'],There is no description available.,2016-08-19,2016,[u'Iowa Department of Transportation'],93d2409f-a9b2-4235-9796-33a13bb438ed,,40.5779 -96.5211 43.4474 -96.5211 43.4474 -90.2839 40.5779 -90.2839 40.5779 -96.5211,2016,[u'Iowa DOT Open Data Portal'],TruckParkingUtilizationAlternativeServiceLocation_shp,40.5779 -96.5211 43.4474 -90.2839,Truck Parking Utilization - Alternative Service Location: Iowa,Shapefile,"[u'Iowa, United States']",Iowa Department of Transportation (DOT),93d2409f-a9b2-4235-9796-33a13bb438ed,Dataset,
Point,2017-04-05T13:35:19Z,"ENVELOPE(-96.5211, -90.2839, 43.4474, 40.5779)","{""http://schema.org/url"":""http://public.iowadot.opendata.arcgis.com/datasets/5c326ac6cb8c4e8192181a1c0d189174_32"",""http://www.isotc211.org/schemas/2005/gmd/"":""https://opengeometadata.github.io/big-ten/74/68/af/5c1302419089630e9c5c2139e3/iso19139.xml"",""urn:x-esri:serviceType:ArcGIS#DynamicMapLayer"":""https://gis.iowadot.gov/public/rest/services/Facilities/IaDOT_Statewide_Rest_Area/MapServer/32"",""http://schema.org/downloadUrl"":""http://public.iowadot.opendata.arcgis.com/datasets/5c326ac6cb8c4e8192181a1c0d189174_32.zip""}",Public,7468af5c-1302-4190-8963-0e9c5c2139e3,Iowa,[u'Transportation'],Iowa Department of Transportation statewide rest area data. This layer displays alternative service locations that have restrooms with unknown operating hours.,2016-08-19,2016,[u'Iowa Department of Transportation'],7468af5c-1302-4190-8963-0e9c5c2139e3,,40.5779 -96.5211 43.4474 -96.5211 43.4474 -90.2839 40.5779 -90.2839 40.5779 -96.5211,2016,[u'Iowa DOT Open Data Portal'],AlternativeServiceLocationsRestroomHoursUnknown_shp,40.5779 -96.5211 43.4474 -90.2839,Alternative Service Locations - Restroom Hours Unknown: Iowa,Shapefile,"[u'Iowa, United States']",Iowa Department of Transportation (DOT),7468af5c-1302-4190-8963-0e9c5c2139e3,Dataset,
